"November 18, 2017",5.0 ," sat read least 50 review phone without ever feel like actually learn something couldn't already find product description. sure people enjoy confirm product say it's helpful. anyway, enough rant, review :)i own 5 smartphones previous moto g5 plus (iphone 3g, samsung infuse 4g, samsung galaxy note 2, samsung galaxy s5 active, iphone 6) tend keep device least 2 year upgrading. also add that, general, i'm heavy user internet browsing, news apps podcasts interested social medium photography seem user focused. photo take adequate purpose although low light scenario wouldn't expect great detail. video record however stellar situation i've need it. me, best feature phone speed, multitasking ability battery life. own phone nearly 6 month still run fast hold charge long first week fire up. also able simply remove sim card previous phone get work straight away without activation step approval carrier (at&t;) doesn't even offer phone. even least 4-6 solid hour day use multiple apps run 50-70% average brightness, charge phone 90 minute max every day without fail. iphone 6 would barely last full day need regular mid-day charging. honestly can't find anything significantly wrong phone all. go day get suckered flagship device cost 4x much little difference performance. use phone internet, daily use apps (banking, amazon shopping, weather, timers/alarms, reminders, etc.) occasional photo-op phone buy imo. rarely compel write review product i've purchase knowing could save literally thousand dollar last 10 year speak itself. dont believe hype flagship phones!! motorola's game long time still know what's :)",positive,['price']
"August 15, 2017",5.0 ," phone awesome. 64 gb build add 128 gb sd card plenty storage phone add apps want. phone could add apps onto sd card phone add all. speaker phone work great people im talk problem hear me, phone people always say couldn't hear phone solve that. unlocked trouble switch phone cell phone provider simply put sim card call put serial number service worked. phone amazon offer supper good great deal especially since buy amazon day. concern would get lot ad amazon minimal bother all. also 4 gig memory phone super fast. happy buy phone, specially since even great discount amazon day. way go amazon.",positive,['faulty product']
"May 6, 2017",4.0 ," i'll start say great device work splendidly. use verizon wireless work perfectly (i problem verizon's end incomplete activation phone sim). also test china unicom june go china i'll write experience remember get back. finger print button work great really convenient, also use back/home/applications button. camera pretty great quality phone cheap well, haven't use much extensively encounter problem i'll come back share. don't really care much nfc since i've never really used see many people use everyday life. may also add processor 4 gb ram thing make impressive performance.the two reason i'm give 5 start is:1. speaker loudest, kyocera brigadier prior phone speaker little thing able get quite bit high speaker thing. get annoy you're semi-loud area something background tad loud still can't hear person line loud clear speakerphone volume way up.2. call amazon want pay remain difference get rid ad (this month get phone, money spend) however amazon customer service person tell way get rid ad would return device buy one without ad order so. think ad could take amazon paid difference suppose phone (if anyone know way customer service person couldn't find please let know)overall would definitely recommend phone, price point also quality give price point.",positive,"['customer service', 'price']"
"July 13, 2017",5.0 ," i'm extremely pleased phone. price, get phone specs couple year ago would cost nearly $700.. i'd recommend 64gb, 4gb ram version ads, totally worth it. 4gb ram $300!! !.the moto g5 plus come nearly stock android 7 4gb ram sssoooo smooth. navigate apps launch seamless. nice feature quick twist launch camera, surprisingly good, take picture nearly delay. basically take photo fast press capture button.i use play games, emulation gta san andreas run super smooth.the battery life also stellar light usage easily get two day without charging. turbo charge feature handy.overall, please feature phone market new android phone highly recommend performance feature price range unbeatable.",positive,['price']
"April 25, 2017",2.0 , fast sexy issues. poor phone reception due antenna. hold phone two finger edge bottom phone get clear voice phone. cover back hand manner normal use voice reception go unintelligible. frustrates i'm talk to.,neutral, 
"June 11, 2017",4.0 ," get phone several reasons. first reasonably price well rated. second unlocked, third advertised capacity use dual sim cards. plan trip country want able use phone go local sim. obtain sim, activate go install phone. discover phone sell different sim tray u rest world. u tray fit one one sim card. replacement dual sim tray available china would arrive time. guess swap card get go swap back arrive home.also note instruction come phone show dual sim tray make mention two.i like phone display functions. hold charge long time versatile enough me. one complaint volume phone call loud. btw, don't even notice ad amazon use amazon apps like them.",positive,"['customer service', 'price']"
"April 26, 2017",5.0 ," find phone amazon chance. aware phone ad don't mind ad fire. ad lock screen don't bother save $60 64gb phone wow!pro: spec phone great fast. use blue iris surveillance software app update 4 cameras; use freeze old phone phone. really great specs price range. android 7 don't need sd card 64gb memory.con: camera protrude case laid phone it's back, actually lay camera lens. would rather flat back protrusion. could cause point loading, possible point failure. get yootech temper glass screen protector spigen rugged armor case fit fine protrusion back protected.i republic wireless (rw) phone service one phone ""bring phone"" really best choice price range. sim card amazon well $5 price rw site. get phone sim card 2 days, charge it, put sim card in, back old phone google, turn phone, sign google account, download rw app play store, go online chat rw walk set phone minutes. use old phone number apps update (did sign back them). easy.",positive,['price']
"September 20, 2017",5.0 ," amaze phone $500-700 le iphone!i use iphones years, last iphone 6+. go change carrier couldn't get iphone 6+ unlocked. i'd think try one new samsung phone think i'd try one see could live android many year use ios.the phone solidly built, feature want (camera, bluetooth,, headphone jack, fingerprint sensor oh wait iphone x leave ;-), seem plenty fast. flashlight actually bright iphone's easy turn (2 quick shakes). also love silence ringer place phone face time set turn ringer back (can turn ringer set period time).i haven't do much camera take decent pictures.i certainly rush plunk $800-$1000 new phone. i'm happy one.",positive, 
"April 29, 2017",5.0 ," phone sinfully good consider price. complaint lack usb-c, c'mon, look price. addition wonderful android device, moto g plus motorola device! mean wonderful gesture motorola device know twist camera chop light.the fingerprint sensor deserve paragraph. sensor! size perfect, responsiveness put many flagship shame, fingerprint sensor gesture gift high. don't know ever get along without fingerprint sensor gestures, i'm glad now!",positive, 
"August 18, 2017",2.0 ," phone since april, first seem like great device, trouble started. could understand anything person end saying. would reboot would fine couple hour call would break again.so figure bad phone exchange another.same problems. research find lots people we're thing happen them.went lenovo/moto forum find thread problem.lenovo know since april. keep say work it.on august 16th release ""fix"" 3 day still uploaded phone.what's bad people respond say problem still exists.i'm ready find new non moto phone.",negative, 
"August 22, 2017",4.0 ," reluctant get phone think hold new version moto x, use phone little couple months, really like lot! it's fast, responsive, i've weird issue bluetooth call drops. it's perfect size me, big small like new feature come nougat build in. turbo charger great really cut charge time. would say negative phone lack nfc (can't use android pay) sometimes earpiece speakerphone loud enough. real complaints. seem like you'll get average 3-4 year phone replace it, right price v phone $500+",neutral,"['customer service', 'price']"
"July 30, 2017",4.0 ," compare 4 year-old moto g, clearly evident moto g5 plus rapidly technology continue advance. lightening-fast speed operate system applications, particularly photo application, truly astonishing. beyond speed, improvement quality photo videos phone produce also quite achievement. i'm also impressed high quality lcd screen, sharp bright enough easily view broad daylight. snap connect t-moble account transfer android contact information store old machine cloud. especially enjoy use fingerprint sensor navigate android page thereby make available additional space icon screen.the one minor drawback find moto g5 plus somewhat bulky, result considerable size weight.",positive, 
"August 12, 2017",5.0 ," great phone compare anything i've before, high end phone though i've never felt need drop $600+ ""flagship"" phone don't anything more. original moto g, moto g lte, enjoy though slow side. phone akin 2nd tier phones, i.e. company's flagship models. happy get prime day deal 4gb ram. didn't really need 64gb memory, extra ram memory certainly make phone quick everything throw it. wait another deal like prime day deal upgrade wife's phone. use cricket wireless problem there. easy upgrade use online chat cost. need nano sim, depend previous phone has, might need go store buy one (best buy often run deal cricket sim cards).",positive, 
"October 22, 2017",5.0 , buy replace five year old phone since battery old phone get weak. almost give try find phone would work seamlessly worldwide. saw review one true world phone get it. carrier verizon use different frequency verizon use cdma instead gsm. spent two week relatives england work without hitch. get england buy english sim card ee (orange) soon pop card english phone number online. phone work worldwide nice phone entirely adequate features. absence nfc effect either usa england. live rural area relative also live rural area. seem place find merchant accepts nfc big cities.,neutral,['customer service']
"April 17, 2017",3.0 ," guess price phone ok. it's flagship phone, tell soon run benchmark it, result (50.000 something) fact graphic choppy benchmark running. guess price range can't ask much?it get 3 star though fingerprint scanner take half inch space front phone serve purchase, add 3 software home keys, back etc...and lose 1/4 front phone. amazon come ad google search top 4"" phone left, ridiculous...android 7 yes, run 2 apps simultaneously, soft key still there, thanks thanks, phone definitely 5.2"" end...people mention performance, guess money, keep mind snapdragon 625 cheap option 820. top notice 4 ""spotlights"" display, top phone! actually think it's suppose be!recappros:4gb ramandroid 7dual simsd carddual flash4k videomany bandsvolte wifi callingotg supportwide lens selfiescons:very bad interface! (returning reason) update: edit interface button etc, betterbad quality screen! (i see 4 light top phone, like spotlights! wth??? )very small usable screen (because interface)low end cpu snapdragon 625graphic performanceno nfcbad design (fingerprint scanner take much space)no ac wifi! *if run different launcher thing get little good also change display setting small icon small font.",positive,['price']
"June 9, 2017",5.0 ," phone cdma gsm radio mean activate sprint att. lead believe purchase sprint sim card plug in. use sprint sim card one active phone plug in. get sprint network couldn't use plan it. seem still call sprint activate sim card using, even already activated. oh well, activate new sim card would fine plan. phone great, work well call data.",positive, 
"September 24, 2017",2.0 ," so, appreciate battery life phone fairly sufficient, appear decent amount space memory wise, reason phone can't seem handle google system. much phone take ridiculous amount time reflect action, particularly google search, google voice. need restart fairly often order function. require cleanup app revisit regularly. little bit lag last phone, borderline 4 year old (moto x 1st gen). go motorola like last phone. phone huge disappointment, weren't solid battery life, i'd switch back old phone now. wish i'd return minute saw act slow. it's get worse, i've already try clean application space already sd card space well. phone waste money, i'll probably get another within next 4 months, can't imagine it'll even make 6 months.that said, amazon addendum product whathaveyou advertised you, doesn't appear big deal.if buy phone, buy warrantee.",positive,['customer service']
"August 20, 2017",5.0 , samsung galaxy s5 last 3+ year start fail miserably. want buy another samsung galaxy s8 something else would cost $550+ range. moto g5 plus much use samsung galaxy s5. android 7.0 nugget excellent. much customization do motorola. believe bare product android 7.0 nugget instal qualcomm snapdragon 625 2ghz processor 4gb sd-ram drive. plenty space 64gb. mount old mini sd card 128gb work well. screen fullhd 1080p 424 ppi excellent. camera work superbly. happy moto g5 plus readily recommend product anyone.ps: today receive trade-in offer email samsung s8 slightly less $500/- decide ditch offer.,positive,['price']
"August 22, 2017",4.0 ," 32g moto g5 pluspros:camerascreen clarityspeedandroid 7 nougatadaptive storage option build ingsm cdma unlocked, though work u cellular's network.battery fast chaargingloads storagecons:lousy contact app included, download google's well applousy message app, yet find good onevirtually email app, gmailwill work u cellularvery poorly write user guide available download.in summary, it's excellent value. many tech review classify as, ""the best budget phone available."" many ""cons"" note rectified. commit i-phone 7, galaxy, take look this.phone.oh btw, motorola own lenovo.",positive, 
"May 9, 2017",4.0 ," first budget phone work really well like lg v10 come last year. moto g5 plus really fast respond plus me. heard watch video phone pro's con one gps. lie. uber/lyft driver first seem true gps go setting set high accuracy battery save mode. addition battery power really good. charge phone completely last day. watch lot videos, play lot games, watch movie browse internet last day. sometimes don't battery full still last day. basically phone pretty much everything compare $700 1000 phones.",positive, 
"December 8, 2017",5.0 ," absolutely love phone. especially comparison upgrade iphone 5c. sick endless, storage-eating io upgrades. phone great interface, easy learn use, ton data storage, automatic backup google picture videos, short many feature iphone, blow away. can't imagine ever pay three five time cost moto get new iphone. never get iphone again. it's android way on.",positive,['price']
"June 24, 2017",5.0 ," phone 2 week now. love far.pros:cost, fast, responsive, good call quality, great t-mobile network, gesture shortcut camera, battery, camera take good picturescons:video music sound low tinny, location home back buttons, gesture shortcut flashlightnote gesture shortcuts:holding phone twist wrist leave right open camera, work awesome never fail launch, love feature.holding phone make shake hand motion karate chop motion open flashlight, work well break wrist try get work, work like 1 10 tries, bad doesnt work well would like did.overall would definitely recommend phone, opinion par flagship phone fraction cost. think one upgrade every 2 year type phone still spend less cost 1 flagship phone, frankly much better!",positive,['price']
"August 20, 2017",2.0 ," cons: button way easy accidentally press: twice week find phone turn completely change it's volume settings. power button side phone annoying: simply hold wrong way enough accidentally lock phone. gesture system camera cannot turn off: delete 100 photo inside pocket every month walk activates camera. frequent freezes: particularly wake phone (as alarm go off, turn screen), phone lock 2-15 seconds. *extremely* annoy phone ignores attempt silence excessively loud alarm (see above).pros: cheap reasonable camera mic make calls, read e-mails, search google.",negative,['price']
"June 3, 2017",5.0 ," absolutely love phone, look market cheap phone still well previous samsung galaxy s4. heard this. question amazon version thinking spammed ad's every time open phone. wrong save $60 get amazon feature know love prime member good true. phone didn't feel cheap sturdy metal back it, responsive finger print sensor, good size, great cameras. overall would highly recommend phone look upgrade spend stupid amount popular brand name still get key functionality.",positive,['price']
"September 15, 2017",5.0 , got burn defective htc 10 fail day warranty expire provider refuse bend. great phone twice price. love card slot put ton movie tv show work. battery hold enough charge watch show 10 hour shift power spare. plenty process power i've never able slow game apps installed. could care less screen resolution 1080--it still look great bright. camera sharp one htc 10 job. encounter problem talk phone others disable enhance 4g lte mode find lenovo forum issue gone. (i blame verizon anything) bottom line: best phone price.,positive,['faulty product']
"May 27, 2017",5.0 ," moto 5g plus. get 64gb internal memory 4gb ram. phone awesome. look great unlocked phone great specs, 4gb ram, 64gb internal memory, fast prcessor, great price, software bloat ware embed phone, great battety. it. get ad $240 ad $300. wow, great deal awesome phone. android 7.0 nougat, spartan quick software bloat ware. 7.0, sd card format internal, one large internal flash drive. awesome. love phone. s4 s5 switch motorola. happy.",positive,['faulty product']
"June 21, 2017",5.0 ," great phone--a real upgrade beloved iphone4. wifi call great! camera ansel adams perfectly adequate phone. fast, expand storage music near future memory card-apple can't that. work easily bluetooth hyundai santa fe, location accuracy good. look moto 4 g5 plus released, sooo glad waited! leave verizon 20+ year go republic wireless, happy far service. best part--with moto g5 plus change carrier whenever choose. doesn't feel like budget phone, thin good screen size, big. amazon ad intrusive.",positive, 
"October 7, 2017",4.0 ," i've phone 2 month like it. get amazon day something discounted. feature miss old phone i'm crazy contact setup, message app, little thing i'm happy purchase. people seem hard time hear phone too. lock screen ad big deal saving. don't mind preloaded amazon apps either. size good it's heavy. i'm big techy phone person need far haven't many issues. camera take nice pictures. we'll see long last since thing make last next model release days. previous phone start act around 10 month i'm hop that's case time!",positive, 
"September 16, 2017",5.0 , love phone. price cannot beat. battery last day it's buttery smooth. come iphone 6 plus required recharge lunchtime slow time replaced. android o far advance ios.,positive,['price']
"April 30, 2017",5.0 , play asphalt 8 take beautiful picture plenty storage navigate menu finger print scanner perk build android display real nice,positive, 
"September 28, 2017",4.0 ," it's great phone high c/p. score one 4gb/64gb prime day, month later it's still run great. wish moto would've keep release new firmware security patch like use to. unfortunately lenovo take company don't really care firmware update anymore.",positive, 
"July 25, 2017",5.0 , buy 2 these. gold grey husband. moto g4's 2gb ram. want 4gb phones. opt ad version. work great tracfone. happy them.,positive, 
"September 17, 2017",5.0 , find google app launcher cause freeze restarting. disable google download microsoft launcher far it's great. really love phone hope fix problem.i love phone feature receive it. 3 week freeze restart alot. i'm hop doesn't die me. would like know fix this.,positive, 
"August 26, 2017",1.0 , phone weak phone. ask much smartphone typically text message web surf email. phone even receive text message email phone call. bluetooth functionality weak struggle connect device already establish relationship with. use jeep aftermarket radio phone automatically connect start vehicle play anything manually disconnect reconnected sync play music. terrible choice highly recommend consider phone choose another option even pricey.,negative, 
"August 13, 2017",4.0 ," far good, nice phone, wish 5.5 inch screen, sound speaker leave lot desired, get different app camera like one provide moto/lenovo battery phone amazing, lag stutter happy far, month quite happy it, wish screen little brighter idol 3 alcatel well screen moto g 5 plus.",positive, 
"November 2, 2017",5.0 ," great phone. absolutely love it, highly recommend it. annoyances, nothing make regret purchase. worry amazon ad purchasing, proven definition unobtrusive. tip- use app permanent lock screen notification, weather bug, never see full screen amazon ads; you'll get small bar notification ad.",positive, 
"August 1, 2017",2.0 ," moto g5 plus good phone. real problem, get phone 3 day sim card came. instal usd card setup phone wifi. get sim card card tray would open. stuck. seem put card time fit. good 4band unlocked phone cave weak try slot. bad great phone otherwise.",neutral,['faulty product']
"September 13, 2017",5.0 ," 'm enjoy new phone, first motorola last 7 years. moto g plus(5th generation) 64gb awesome since it's unlocked gsm phone,you almost carrier there, like at&t;, consumer cellular,ect.",positive,['faulty product']
"August 17, 2017",5.0 ," pick one costco (32 gb version). it's excellent phone price. it's responsive lot nice features. love fingerprint scanner bright high-res screen. feature wish good camera. it's lot well last phone's camera (blu r1 hd), good iphone's. give price, it's excellent value.",positive, 
"June 28, 2017",1.0 ," buy cell phone seem lousy quality motorcycle pay tax import phone ecuador turn photo never work anymore, lousy cell phone recover money purchase send usa, tax return spend 190 something unusable",negative,"['customer service', 'price']"
"July 5, 2017",2.0 ," mess up. think buy unadulterated phone. get one ad offers. need phone, i'll probably keep it. activate today seem work fine. 32 gb memory price huge bonus. previous 8gb starter phone at&t; contract almost memory activated. moto g5 huge improvement. think get ""prime deal"" moto g5. ad offer extremely annoy way get rid them. mistake. fault amazon. wife actually use phone, maybe won't notice. would 4 5 star product without ads.. maybe i'll learn read ""prime"" offer little closer.",neutral,['price']
"April 6, 2017",4.0 ," complaint don't know they'd put 2gb ram phone. i'd rather trade storage space ram. android o take nearly half ram, there's really much leave everything else. phone constantly run 90% ram used. haven't problem slow down, though--yet.",neutral, 
"November 1, 2017",1.0 , own phone le 4 months. 3 month start trouble send receive mms messages. put airplane mode back multiple time order get mms message download. also experience multitude issue get sync car bluetooth bluetooth devices. two issue finger print sensor stop work entirely. phone didn't even recognize fingerprint sensor option change edit fingerprint option entirely missing. search online find common problem often require phone repaired. opt fix faulty phone cut losses.buyer beware. awesome phone start quickly fail you.,negative, 
"September 7, 2017",1.0 ," i've le three months. it's super glitchy. freezes, give black screen, self restarts, several time day. i'm use little space phone. motorola useless help solve problem. complete waste money. friend phone love it, definitely get lemon, i'm stick it. it's barely usable.",positive, 
"September 9, 2017",4.0 ," good phone easy use. since old asus phone, vast improvement it.the reason take star case slippery hold. still wait protective case amazon, unfortunately, slip hand drop hard concrete. edge paint look like metal, really make plastic. chunk miss corner edges, see expose plastic underneath.i drop old asus phone quite time past, always survive falsl stay intact. phone cost 5x old phone cost lot less sturdy.",positive,['price']
"August 14, 2017",3.0 ," good:the metal body really nice, screen prefect, ad aren't annoying, fingerprint sensor work great, loud speaker, great battery, fast battery charging(1hr less), one button navigation.bad:well wish buy old phone (moto g3) again. doesn't water proofing, like use phone swimming....yea...i know. doesn't get signal old phone did, get 3 bar old phone, 0 this:( music streaming service consistently stop working, due horrible antenna, plus seem freeze quite lot...i mean loooot. good luck use google browser, run slowww.",positive, 
"July 19, 2017",5.0 ," price, nothing beat phone! it's well built clean stock android experience super fast easy use! even though doesn't flagship cpu, it's fast. wish include nfc android pay. clearly best budget phone out. even beat many midrangers too. love it!",positive, 
"September 5, 2017",5.0 ," great replacement old galaxy s5. work fine verizon, near-stock android great experience. spend twice much flagship model manufacturer, unless must nfc absolute waterproofing? phone drawback shortcomings actual use. good performance great value.",positive,['customer service']
"November 10, 2017",5.0 ," iphone least past 5-6 years. switch don't want go back. it's user friendly, everything want nice camera.",positive, 
