"April 30, 2017",5.0 ," couldn't happier. absolute steal price. perfect size. decent screen mean it's good get decent. camera work great. video 6k whatever rate human need. ad intrusive fact set fingerprint correctly learn use skip past mostly even see it. 5.2 inch screen seem small consider set use fingerprint scanner replace normal navigation button (back, home, recent). button screen, dedicate buttons, remove completely.pictures: take phone pocket purse etc, twist twice without open device, camera on. miss shots? doubtful.camera: default rear facing, motion (twist twice) flip front (or back depending). good set controls, htr still figure seem work. expert mode faster response opinion. regular mode still control ""exposure"" finger. fast zoom, good focus. panorama slo-mo work fine. video quality excellent.wifi call work great.can't tell nearfield whatever it's called, probably set up. i'm even sure fact think not. can't tell could care less feature. already carry wallet.basically stock android (that's good thing). moto/lenovo put much top it, make work well actual device.when open say ""ok google"" ask question works. pretty cool. ""hey wiretap cat's eat pancakes?"" yeah nothing could possibly go wrong here. ""ok google order tinfoil hats, stat! ""look price, $230, get octocore 64gb/4gb device good call quality (sound) dual sim capable, memory card capable, fast charging, long lasting battery, great device. well set up, non intrusive ads, let face order amazon anyway likely prime (for benifits, video book music, music storage (yes even take itunes) etc etc, stuff installed. well except music. think. anyway come lot amazon application installed. alone it's worth it.for people like me.... well that's whole story. upgrade from... htc evo4g (htc supersonic). original 4g phone sell united states. top line time, terrible battery seidio 3000 ma/hr super case etc guess 4 year root tweak rom still use day ago. phone, lot less pay evo, still longevity. why? octocore. 64 gb storage build in, 128 gb card add. lot distance go even start root thing intention need to. mean it's 2ghz processor. think gpu like 650 fine.look plan play 3d game etc, maybe upgrade tried couple kick work. isn't flagship phone. it's good. music bluetooth sound good. speaker little tinny what. doesn't bluetooth speaker days?? right wiretap mean alexa? ok google. cat dog two nsa listen device it's really talk anyway.if however average user, want decent camera, fast processor, etc, it's great phone. worry would miss features. don't. buy it, it's worth every penny.",positive,['customer service']
"June 17, 2017",5.0 , love phone. it's great far good battery life. research lot yes could buy good one would cost twice much. i'm glad take verizon store activate (for free) instead buy sim try myself.,positive,['price']
"June 8, 2017",5.0 ," buy phone sister like much want one myself. astound couldn't buy second one. me, solution easy: sister buy one use account. (i keep first one set second one her.) aware want buy multiple amazon-ad version phone, might restrict one per account.if don't want spend several hundred dollar smart phone want high quality device that's responsive, feature-rich, full bloat-ware, phone ideal.in particular order, feature really like impressed with:* long battery life. particularly turn cell radio wifi (putting airplane mode re-enabling wifi), phone last long time even use heavily. comfortably use day without worry battery die recharge. phone really responsive, even 2gb version, never feel like it's overwhelmed. bloatware. haven't check see delete amazon apps, pretty much apps ""bloatish"". lenovo put ""moto"" app on, allow turn fingerprint reader gestures. g5 plus run nougat, recent iteration android operate system, others price range, many expensive, still run marshmallow. far, really like nougat. briefly consider purchasing lg phone, purchase lg tablet bit year ago which, like, never update lollipop marshmallow, lack faith phone would upgraded. love gesture-enabled fingerprint reader. place front device increase utility. read one professional review g5 plus yesterday say hard get use reviewer preferred traditional separate control buttons. (you don't enable gesture feature reader don't like it.) i'm fan lot gesture control rarely use apps, take fingerprint reader gesture easily find natural intuitive. reader gesture consist of: return home; open card previous/recent apps; swipe back previous screen; open google search assistant; sleep/turn screen. couple hours, gesture become instinctive. two take bit longer distinguish open google turn screen, since would sometimes accidentally open google instead turn screen. however, even take less day master. build quality excellent. metal back nice. plastic bits, body metal. screen smooth responsive. it's lightweight sturdy-feeling fit well even smallish hand. image quality great true colors, great brightness, sharp details. camera take excellent photo give user lot control exposure, etc., use available much expensive devices. even almost-dark room, take good pictures.i'd definitely recommend phone anyone. bit money, get one 4gb ram, one please 4gb version price range.",positive,"['customer service', 'price']"
"July 24, 2017",5.0 ," quite literally best budget phone could ask for. spending many hour look similar phone finally decide one best bet. battery life incredible, speaker loud sound good, absolutely lag use charge super quick. camera bit lacking quality mean rest phone work well price can't complain least bit. absolutely impressed.",positive,['price']
"July 18, 2017",4.0 ," great phone. need wifi call volta at&t;, hope update come soon. bad deal $180 work at&t;, verzion, sprint, t-mobile.",positive, 
"June 9, 2017",5.0 ," lock screen ad moderately annoying. excellent camera, front back. phone fast responsive. best value phone market. big time performance moderate price tag",positive,['price']
"April 17, 2017",5.0 , buy daughter briefly own moto g4 charge problem send back. say g5 even well really likes it. fingerprint thing tickle pink.,neutral, 
"April 6, 2017",5.0 ," buy 64 gig ads. replace moto x pure quit 15 month use multitude battery life issue begin updates installed. swear motorola product experience many choice carrier friendly phones. far love phone, sim card old phone snap install verizon work fine, issue yet. kind don't like issue regard one's privacy google hand everything old phone breeze transfer. also hesitant get version ad use amazon alot save $60 non ad version. ad barely noticeable me. write would definitely recommend phone, update review opinion changes.",positive,['customer service']
"May 22, 2017",5.0 ," great phone...i love motorola product one didn't let down. little skeptical buying amazon, saw come directly motorola go it!",positive, 
"May 25, 2017",5.0 ," love new moto g plus (5th gen), work description good time android 7 system google/amazon easy use phone",positive, 
"April 12, 2017",4.0 ," motorola fan years, go back original rzrs, inexpensive upgrade moto droid turbo. however, sim tray phone disaster. afraid go break latch hold tray push hard release it. get released, hard remove. get removed, hard seat sim card sd card. get seat properly, hard push tray back slot. read comment user seat correctly get lodge inside device. fortunately, manage get right phone work properly. hopefully never remove sim again. poorly design sim card tray, love phone. deliver time packaging excellent. price great insurance much cheap carrier.",positive,['price']
"October 30, 2017",5.0 , wife love 128mb card ad apps world,positive, 
"September 13, 2017",5.0 ," best phone price, buy amazon adds, great discount won't notice",positive, 
"July 10, 2017",5.0 ," great phone, run smoothly, really love it. hold well weld sparks.",positive, 
"May 30, 2017",5.0 ," two week since activation great phone, problems. compatible verizon. order nano sim card since old phone micro sim. several phone call verizon able activate it!",neutral, 
"October 10, 2017",5.0 ," great phone especially graphic camera. big, small, right. buy motorola phone year continue satisfied quality products.",positive, 
"October 1, 2017",3.0 ," great phone, say come amazon advertisements, boy it!",positive, 
"June 9, 2017",5.0 ," mobile awesome, great speed, amaze pictures, long life battery last 35 hour one charge. really recommend mobile, best choice affordable price.",positive, 
"October 25, 2017",5.0 ," always spend money,$600 more,but would fill rip compaired phone speed agility features.$800 compaired $200...save money.as forrest gump would say,""that's got say that.""",neutral, 
"October 29, 2017",5.0 , far good. good camara resolution. keep updated problem.,neutral, 
"October 17, 2017",4.0 , buy one replace nexus 4. good phone fast battery last 2 day moderate load. issue far fail detect mobile network hard reboot (i'm use cover accidental reboots happen sometimes). reboot couple time pick network,neutral,['customer service']
"September 5, 2017",4.0 , miss feature old samsung money nice phone.,neutral,['price']
"September 16, 2017",5.0 , quality worth price.,neutral, 
"August 6, 2017",5.0 ," awesome phone. run software program quickly minimum freeze issue adequate ram build in. fingerprint id super fast, like unbelievably so, yet still accurate.",positive, 
"April 26, 2017",5.0 , far good. lovin' moto.,neutral, 
"August 22, 2017",5.0 , buy phone upcoming travel japan. clear vivid display. excellent picture quality.,positive, 
"April 5, 2017",5.0 ," i've use prepaid verizon moto g play month purchase vr headset discover two thing really need phone didn't have:1. high re screen2. gyroscopic featureso buy 4gb/64gb version moto g plus (5th generation) receive yesterday. take phone local verizon store able transfer prepaid account new device. g5 use different sim card minute get thing sort out. i've use phone several hour play around virtual reality 3d movies. wow, fun look great, too!i actually really like finger print sensor unlock phone, too. i'm happy camper point phone, expensive usual $100 devices, well worth price.",positive,['price']
"April 29, 2017",5.0 ," 2nd motorola moto phone. first one 3 years. last year slow frustrating understand phone aren't make last forever. like much knew get another phone, want another motorola moto.",neutral, 
"June 4, 2017",5.0 ," great phone, great price.",positive, 
"July 18, 2017",4.0 , work advertise quite good,neutral, 
"September 7, 2017",5.0 , phone works.,neutral, 
"September 6, 2017",5.0 , good mid range phone that's amaze value,positive,['price']
"July 19, 2017",5.0 , purchased prime day week metropcs hooked problem need upgrade nano sim card work great work smoothly run business everything need plus enough space download movie kid,neutral, 
"April 28, 2017",5.0 , great phone great price. battery last 1 1/2-2 day charge quick. would recommend highly.,positive, 
"September 23, 2017",5.0 ," good, especially, moto apps, sensor control fill, close blackberry os10 system!",neutral, 
"April 23, 2017",5.0 ," awesome phone money. purchase 64g success far. phone fast. video playback good. picture turn nice right light, even take bunch rid turn decent. low light turn dark. cell phone expect. overall happy pic quality. like photo edit option write draw pic. battery last, big plus me. stream music day work, email, text, social medium charge till evening.i ad phone really problem me. small ad cool home screen, move screen way back. lock screen ad problem,. finger sensor work great like one touch moto button.overall good phone price",positive,['price']
"October 24, 2017",5.0 ," buy mom, go back indian work like charm there.",positive, 
"May 24, 2017",5.0 , amaze phone pricei've use almost 2 months...no problem whatsoever,neutral, 
"October 3, 2017",5.0 , love work good nice,positive, 
"July 28, 2017",5.0 , amaze device....,positive, 
"August 18, 2017",3.0 ," work great, 5 month start misbehave.",neutral, 
"June 4, 2017",5.0 ," probably best low cost phone i've ever owned. it's super fast, great screen decent camera.",positive,['price']
"December 3, 2017",1.0 , microphone totally stop work two months. cannot even use basic phone. apparently poor quality control.,negative, 
"November 22, 2017",5.0 ," screen big last phone. storage space amaze even without additional card. sound better, clearer. doubt phone commercials, worthy investment!",positive, 
"May 29, 2017",5.0 ," inexpensive, great phone, camera good, large storage capacity, love late android software.",positive, 
"June 6, 2017",5.0 , great battery life fingerprint scanner handy thought would be.,positive, 
"July 21, 2017",5.0 ," awesome phone, love performance.",positive, 
"July 28, 2017",5.0 , great phone ad nuisance,positive, 
"October 13, 2017",5.0 ," work like charm, fingerprint reader way faster think battery life awesome. recommend",positive, 
"June 30, 2017",5.0 ," ok, believe purchase buy happiness, phone exception. use month greatly impressed. fast device own. great work play. exhaustive comparison phone consistently recommended. negatives: get case protect flush slight bump camera.positives: need charge every night mine go 2 3 day charge. also phone charge full half hour. full cleaver features. get 4gig ram, large storage. amazon add irritating, appear lock screen unlocked save $60.",positive,['faulty product']
"December 7, 2017",5.0 ," like lot. everything well grand prime samsung. great phone, good price.",positive, 
"April 4, 2017",5.0 ," 3rd moto increase generation memory each. g3 8gb upgraded g4/16gb prime phone soon available. time go 64gb put storage performance issue behind me. love g4 g5 even better. love go camera mode twist wrist flashlight mode hatchet chop. me, amazon ad non-intrusive well worth $60 saving. google transfer apps soon log onto google move sd card g4 g5 move photo music. hassle nano sim micro sd card direction far clear, video youtube get straight. love fingerprint reader touch right leave forefinger unlocks phone much easy enter pin number g4. camera seem focus faster take decent pictures. apps load quickly phone seem fast. great phone great price!",positive, 
"May 24, 2017",5.0 , excellent price quality ratio.best class.you really can't fault phone consider price.definitely would recommend.,positive,['price']
"April 19, 2017",4.0 , own couple week really like it. enough memory put apps want great add sd card picture work well. miss feature nfc live without google pay. work great t-mobile network me.,positive, 
"October 19, 2017",5.0 ," good android phone. glad make decision order pixel 2, phone adequate you're someone need phone essential 2017 thing without really really fancy stuff.",positive, 
"June 5, 2017",5.0 ," didn't want purchase another expensive phone. prepare spend almost $1k another iphone. co-worker tell phones, read almost 2k reviews. oh gosh! i'm soooo happy! one complaint. battery life unreal; charge every 3 4 days, many apps phone. think i'll loyal fan, on.",positive,['price']
"April 8, 2017",5.0 ," impressed.i pick replace moto g second edition purchase mother.i little worried might easily able navigate one touch button comparison soft key button bottom screen old phone.i surprise see option use phone either mode disable one touch button moto setting app, essentially shrunk screen slightly make room old style soft key buttons.when show 71 year old mother difference two option decide try navigate single button day use phone decide like well three soft key always displayed.i wasn't aware single button work set phone up. swiping leave back, right brings recently use apps. tap lightly bring back home screen, press firmly turn display without reach power button side phone. take little practice, also able use lighter long press button bring android assistant.she didn't want fool around set fingerprint scanner, can't report feature.in december 2016 give ghost original moto x pick moto x pure edition sale big box store $249.99.i new moto g5 plus couple day set screen widget get mother's account set give her. say phone seem fast mxpe, noticeable increase battery life.i'm at&t; central ny new moto g5 plus able speedtest faster mxpe connect lte signal. side side test time, mxpe lte download speeed 42mbps, moto g5 plus fast 56mbps.the advantage didn't happen connect wifi home. mxpe peg router 155mbps new g5 plus test 96mbps. (home internet fios amplifi mesh router setup) mother's usage slow time warner/spectrum internet, g5 plus plenty fast enough browse use.neither u find amazon ad screen issue unlock phone.i read another review user easily able remove pre-installed amazon android apps, wasn't found. like hard bake android app, option disable amazon apps, ability uninstall them. mom amazon prime subscriber would end instal main amazon app instant video app anyway.in comparison moto g second edition, mom say call quality well g5 plus, something didn't realize use new phone. say old phone sound ""tinny"" comparison.bottom line, well worth $60 saving buy amazon version mom love new phone, easily adapt one touch button.be good son, buy mom moto g5 plus.as per screen shot attached. 3 widget around moto clock widget create power toggle app, text, gmail, facebook, voicemail icon notification counter create notifyer+ unread count app.",positive,['customer service']
"September 6, 2017",3.0 , amazon apps come pre-loaded except music app.... every time try download play store never loads.... why?,neutral, 
"December 6, 2017",1.0 ," appliance defective volume button, would like change return it.",neutral,"['customer service', 'faulty product']"
"June 26, 2017",5.0 ," use couple days. phone work without problem far. great speed manage apps. camare best, live price phone.",neutral,['price']
"May 2, 2017",5.0 , phone month absolutely love it. battery last almost two day need charging. everything more. picture awesome. pleased phone far.,positive, 
"May 25, 2017",5.0 , excellent!!! great unlocked phone!,positive,['faulty product']
"September 26, 2017",3.0 ," start good almost 2 day battery life ,now last like 6 hour alot memory super fast charger",positive, 
"July 12, 2017",5.0 , buy replace three year old lg g3. purchase 4gb ram 64gb storage model amazon ads. first thing uninstall ads. great camera. fast ui. plenty ram. would definitely buy again.,positive,['customer service']
"December 4, 2017",5.0 , love phone!!,positive, 
"June 9, 2017",5.0 , great phone! snap connect verizon.,positive, 
"October 26, 2017",4.0 ," seem like great phone work u cellular like moto g4 does.......don""t buy use u cellular.....don't shop g4 get suck ""there new version item"".....",positive, 
"May 13, 2017",5.0 ," run fast, feel well made, camera take clear pictures. seem really good phone far. complaint point.",positive, 
"August 8, 2017",4.0 , phone great. extra amazon ad kind frustrate since aren't tailor all.,positive, 
"August 14, 2017",5.0 ," purchase phone friend. absolutely love phone. great performance, everything wants!",positive, 
"October 29, 2017",5.0 ," good phone computer wish, would like good wouldn't get cheap thats i, would better without add amazon others love amazon ok.",positive,['price']
"October 23, 2017",5.0 , love far,positive, 
"May 28, 2017",5.0 ," delighted screen size, brightness overall functionality g5 plus far. i've purchase replace fairly small screen htc explorer, ipod touch stop working.",positive,['customer service']
"April 27, 2017",5.0 ," good phone.got rid samsung smash sucked, wanted something terrible battery life. get little guy.battery life excellent. still 80% point day s4 would 20-25%. 5/5it fast. thing quickly bog applications. 5/5the camera decent. camera good, selfie regular, except sometimes low light situation- expected. 4/5menu organisation much well s4, though still could use improvement logical categories, still decent. 4/5overall good phone. first phone s4 care could tell difference s4 s5 s6. would recommend 4.5/5.",positive, 
"July 22, 2017",5.0 ," great phone money. comparable think, iphone alot money.",positive, 
"August 12, 2017",5.0 , replace another old moto razr phone please new device.,neutral,['customer service']
"October 31, 2017",2.0 ," decent phone first month, sudden data connection start drop out, try make call switch lte h won't connect call. deal typical horrible at&t; customer service buy unlocked phone. shouldn't go deal get phone work imo. new nano sim that's suppose work fine phone.pros it's pretty quick (i 64g/4g model ads) camera good solid lighting. good low light. it's load bloatware, almost strip down, default camera app modify pic lame. and, also ability restart phone, shut completely? that's retarded. work it's decent phone money, ""fully compatible at&t;"" claim less accurate experience. would return could would buy again. might well flush $240 toilet.disliked default option take picture keep try force use amazon cloud backup location instead 32g micro sd want eventually work out.update week ago originally reviewed. still ability make call even go at&t; store twice, can't figure out. phone show lte signal text surf internet fine, soon attempt make call hit voicemail notification, phone immediately switch h can't connect anything, call type works. i've reset network settings, do apn step at&t; website avail. everything work phone call phone beyond me. wish crapped could return it. ""fully compatible"" claim lie us. i'm happy work fine for, first motorola last.",positive,"['customer service', 'faulty product']"
"November 15, 2017",4.0 ," best phone price range ,android version pretty old camera meh",positive,['price']
"May 10, 2017",5.0 , love phone right size right price... amazon prime pricing make right replace blu r1 hd issue china links...:(((,positive,['customer service']
"June 19, 2017",5.0 , best cell phone far ever owned. absolutely nothing dislike!,positive, 
"October 1, 2017",5.0 , good phone. pleased apart slow camera..but may user error.,neutral, 
"September 20, 2017",5.0 , best phone ive owed. number one choice want cheap top line phone. moto deosnt fail meet expectations.,neutral,['price']
"May 17, 2017",4.0 ," perfect phone? there's thing. money though can't go wrong. put verizon sim card, 64 gb micro sd card in. phone recognize verizon immediately. tell audio quality voice good motorola droid maxx echolink app use. phone portion seem fine though. occasionally touch screen become unresponsive seconds. droid maxx also might app running. still recommend phone. edit yes doesn't lte phone.",positive,['price']
"September 28, 2017",5.0 , phone work great amazon add nuisance.,positive, 
"May 23, 2017",5.0 , great performance,positive, 
"September 14, 2017",5.0 , excellent mid-range phone. work well. good value money.,positive,['price']
"May 24, 2017",5.0 ," replace window nokia phone, easy get run moto. good display, call fine, speedy. far good...",positive,['customer service']
"July 29, 2017",5.0 , speedy fingerprint activation reduces need long screen time out.,neutral, 
"August 28, 2017",5.0 , awesome phone foe price.,neutral, 
"October 23, 2017",4.0 , work perfectly dont know twitter app always stop woriking.,neutral, 
"May 23, 2017",5.0 , good phone. amaze new features. work fine 2gb ram. like slow motion video recorder.,positive, 
"April 1, 2017",5.0 ," phone huge, mean can't describe leap technology due fact come moto 3g 1gb ram 8gb storage. size perfect hands, 5.0 5.2 like 4gb ram load main apps multitask. realize include duo app. play around duo, didn't realize make video call android apple io devices!!! duo work like charm wifi people actually call video crisp. yet test cellular network don't think good worth try. would check review duo come last year notice google make significant upgrades duo product make work well simple video mechanism. half family obsess apple io half obsess google android. duo game changer, really crush apple philosophy call video outside apple's property.",positive, 
"August 5, 2017",4.0 ," it's great phone,does everything big shot some,for half cost",positive,['price']
"June 14, 2017",5.0 , great phone. work every sim card put it. complicate setup necessery.,positive, 
"March 31, 2017",5.0 , comparison phone lg g5 iphone 7 plus. phone way well lg far perform well iphone. one button nav odd first get good use it. definitely recommend,positive, 
"April 4, 2017",5.0 ," first all, thank amazon! phone ship military overseas address (germany) day release arrive today.next, 4 moto 4g 64gig home, 2 kid 2 wife. love phone start experience ghost touch mine maybe 7 months. ghost touch would random, would facebook would start touch like button random picture such.... assistant moto amazon agree take phone back. replace g5.i order g5 64 without ad pay full amount due experience phone ads, think worth spend extra $60. also order clear case screen protector sparin, order arrive today. protector case fit phone perfectly.the g5 feel much expensive g4. put aside much difference size i'm able reach thumb side screen hold type one hand. get sim card cut nano fit tray, i've also put sd card. lot test next day camera function don't anticipate anything either like g4 improved.the design feel nice, phone come micro usb cable, power brick, pin sim tray instructions. headphone box videos mentioned. compass sensor. nfc, doubt would ever use included.besides ghost touch issue we've great experience moto plus g4 64, feel g5 even well long run. get phone, need spend bunch expensive phones.",positive,"['customer service', 'price']"
"September 8, 2017",5.0 , awesome,positive, 
"August 20, 2017",4.0 ," problem phone volume. replacement phone, hope stay put. good phone money",neutral,"['customer service', 'price']"
"September 18, 2017",5.0 ," great phone great performance, solid feel, little bloatware, fantastic price.",positive, 
"October 28, 2017",5.0 , wait update oreo. perform expected!,neutral, 
